{
  "play": {
    "mode": "guide"
  },
  "drive": {
    "maxSteps": 64,
    "stallLimit": 12,
    "stepsPerRequirement": 16
  },
  "evolution": {
    "mode": "suggest",
    "allow_paths": ["prompts", "beats"],
    "max_per_run": 1
  },
  "autosave": true,
  "hot_reload": true,
  "gates": {
    "require_all_green": true
  }
}
